post,slug,title,subtitle,cta,final_image,caption
1,comece-com-direcao,Comece com direção,"Triagem, avaliação médica e acompanhamento para cuidar do emagrecimento com mais clareza.",Começar minha triagem,codex-artifacts/social-launch-v3/final-posts/01-comece-com-direcao.jpg,"Se você já tentou recomeçar muitas vezes, talvez o que faltou não tenha sido esforço. Faltou direção.

Na MeJoy, o começo é com triagem, avaliação médica e acompanhamento. Sem atalho. Sem promessa vazia.

Se fizer sentido para você, comece pela triagem.

#EmagrecimentoComAcompanhamento #SaudeMetabolica #MeJoy"
2,seu-caso-vem-primeiro,Seu caso vem primeiro,"A triagem ajuda a entender histórico, rotina e objetivos antes de qualquer decisão.",Entender meu caso,codex-artifacts/social-launch-v3/final-posts/02-seu-caso-vem-primeiro.jpg,"Antes de pensar em solução, vale entender o seu caso.

A triagem organiza histórico, rotina e objetivos com mais clareza. Decisão boa começa com contexto.

Começar por aqui deixa o próximo passo mais seguro e mais inteligente.

#TriagemOnline #EmagrecimentoComAcompanhamento #MeJoy"
3,criterio-antes-de-tudo,Critério antes de tudo,Toda conduta responsável começa com avaliação clínica individual.,Ver como funciona,codex-artifacts/social-launch-v3/final-posts/03-criterio-antes-de-tudo.jpg,"Emagrecimento sério não é receita pronta.

Toda conduta responsável passa por avaliação clínica, com critério e segurança.

Segurança não atrasa o processo. Segurança protege o processo.

#AvaliacaoMedica #TratamentoDaObesidade #MeJoy"
4,voce-nao-esta-sozinho,Você não está sozinho(a),"Com acompanhamento certo, a constância fica mais leve e mais possível.",Conhecer o acompanhamento,codex-artifacts/social-launch-v3/final-posts/04-voce-nao-esta-sozinho.jpg,"Você não precisa carregar esse processo sozinho(a).

Quando existe acompanhamento, fica mais fácil manter constância, ajustar rota e seguir com mais leveza.

Suporte certo muda a jornada.

#AcompanhamentoContinuo #SaudeMetabolica #MeJoy"
5,cuidar-tambem-e-rotina,Cuidar também é rotina,Resultado sustentável nasce do que cabe na vida real.,Buscar constância,codex-artifacts/social-launch-v3/final-posts/05-cuidar-tambem-e-rotina.jpg,"O melhor plano não é o mais rígido. É o que você consegue sustentar na vida real.

Constância, ajuste e rotina possível valem mais do que pressa.

Quando a estratégia cabe na sua vida, o cuidado fica mais forte.

#Constancia #EmagrecimentoComAcompanhamento #MeJoy"
6,historias-reais-sem-exagero,"Histórias reais, sem exagero",Cada pessoa responde de um jeito. O que importa é cuidado com honestidade.,Ver histórias reais,codex-artifacts/social-launch-v3/final-posts/06-historias-reais-sem-exagero.jpg,"Aqui, a conversa não é sobre milagre. É sobre cuidado honesto, individual e possível.

Cada pessoa responde de um jeito. O importante é ter direção, acompanhamento e expectativa realista.

Confiança se constrói com verdade.

#HistoriasReais #TratamentoDaObesidade #MeJoy"
7,resultado-que-continua,Resultado que continua,"Mais consistência, menos ansiedade por pressa.",Entender o processo,codex-artifacts/social-launch-v3/final-posts/07-resultado-que-continua.jpg,"Resultado bom não é só o que aparece rápido. É o que continua fazendo sentido ao longo do caminho.

Sustentabilidade vem antes de ansiedade. Consistência vem antes de impulso.

É assim que o progresso se sustenta.

#ResultadosSustentaveis #SaudeMetabolica #MeJoy"
8,mais-clareza-menos-culpa,Mais clareza. Menos culpa.,"Quando o processo faz sentido, cuidar da saúde deixa de ser guerra diária.",Cuidar com clareza,codex-artifacts/social-launch-v3/final-posts/08-mais-clareza-menos-culpa.jpg,"Quando você entende o processo, o cuidado fica mais leve.

Menos culpa. Menos confusão. Mais clareza para continuar.

Isso também é resultado.

#BemEstar #SaudeMetabolica #MeJoy"
9,entender-vem-antes-de-decidir,Entender vem antes de decidir,O primeiro passo é descobrir o que faz sentido para você hoje.,Fazer minha triagem,codex-artifacts/social-launch-v3/final-posts/09-entender-vem-antes-de-decidir.jpg,"Nem todo mundo precisa da mesma estratégia. Por isso, o primeiro passo é entender o que faz sentido para você hoje.

Se quiser começar com clareza, a triagem está aberta.

Direção antes de decisão.

#TriagemOnline #EmagrecimentoComAcompanhamento #MeJoy"
